{
  "$schema": "../schema/brand.schema.json",
  "version": "0.2.0",
  "updated": "2026-09-04",
  "disclaimer": "Community-maintained reference data. Denominations and redemption rules change often — always verify against the issuer before relying on this in production.",
  "brands": [
    {
      "id": "steam",
      "name": "Steam Wallet",
      "publisher": "Valve",
      "category": "gaming",
      "deliveryType": "code",
      "lock": {
        "keyedOn": "store-currency",
        "onMismatch": "rejected",
        "note": "A Steam Wallet code can only be redeemed by an account whose store currency matches the code's currency. A USD code will not redeem on an EUR account.",
        "verifiedAt": "2026-09-03"
      },
      "redeemUrl": "https://store.steampowered.com/account/redeemwalletcode",
      "code": {
        "lengths": [
          15
        ],
        "groups": [
          5,
          5,
          5
        ],
        "verifiedAt": "2026-09-04"
      },
      "expires": false,
      "regions": [
        {
          "code": "US",
          "currency": "USD",
          "denominations": [
            5,
            10,
            20,
            25,
            50,
            100
          ]
        },
        {
          "code": "EU",
          "currency": "EUR",
          "denominations": [
            5,
            10,
            20,
            25,
            50,
            100
          ]
        },
        {
          "code": "GB",
          "currency": "GBP",
          "denominations": [
            5,
            10,
            20,
            50,
            100
          ]
        },
        {
          "code": "TR",
          "currency": "TRY",
          "denominations": [
            50,
            100,
            200,
            500
          ]
        },
        {
          "code": "AE",
          "currency": "AED",
          "denominations": [
            20,
            50,
            100,
            200
          ]
        }
      ]
    },
    {
      "id": "apple",
      "name": "Apple Gift Card",
      "publisher": "Apple",
      "category": "app-store",
      "deliveryType": "code",
      "lock": {
        "keyedOn": "account-country",
        "onMismatch": "rejected",
        "note": "Must match the country of the Apple Account. Apple merged the iTunes and Apple Store cards into a single Apple Gift Card in most regions.",
        "verifiedAt": "2026-09-03"
      },
      "redeemUrl": "https://apps.apple.com/redeem",
      "code": {
        "lengths": [
          16
        ],
        "prefixes": [
          "X"
        ],
        "verifiedAt": "2026-09-04"
      },
      "expires": false,
      "regions": [
        {
          "code": "US",
          "currency": "USD",
          "denominations": [
            10,
            15,
            25,
            50,
            100,
            200
          ]
        },
        {
          "code": "GB",
          "currency": "GBP",
          "denominations": [
            10,
            15,
            25,
            50,
            100
          ]
        },
        {
          "code": "DE",
          "currency": "EUR",
          "denominations": [
            15,
            25,
            50,
            100
          ]
        },
        {
          "code": "TR",
          "currency": "TRY",
          "denominations": [
            50,
            100,
            250,
            500
          ]
        },
        {
          "code": "AE",
          "currency": "AED",
          "denominations": [
            50,
            100,
            200,
            500
          ]
        }
      ]
    },
    {
      "id": "playstation",
      "name": "PlayStation Store Gift Card",
      "publisher": "Sony Interactive Entertainment",
      "category": "gaming",
      "deliveryType": "code",
      "lock": {
        "keyedOn": "account-country",
        "onMismatch": "rejected",
        "note": "Redeemable only on a PSN account registered in the same country as the card.",
        "verifiedAt": "2026-09-03"
      },
      "redeemUrl": "https://store.playstation.com/redeem",
      "code": {
        "lengths": [
          12
        ],
        "groups": [
          4,
          4,
          4
        ],
        "verifiedAt": "2026-09-04",
        "source": "https://www.playstation.com/en-us/support/store/redeem-ps-store-voucher-code/"
      },
      "expires": false,
      "regions": [
        {
          "code": "US",
          "currency": "USD",
          "denominations": [
            10,
            20,
            25,
            50,
            100
          ]
        },
        {
          "code": "GB",
          "currency": "GBP",
          "denominations": [
            10,
            20,
            35,
            50
          ]
        },
        {
          "code": "DE",
          "currency": "EUR",
          "denominations": [
            10,
            20,
            25,
            50
          ]
        },
        {
          "code": "TR",
          "currency": "TRY",
          "denominations": [
            100,
            200,
            500
          ]
        }
      ]
    },
    {
      "id": "xbox",
      "name": "Xbox / Microsoft Gift Card",
      "publisher": "Microsoft",
      "category": "gaming",
      "deliveryType": "code",
      "lock": {
        "keyedOn": "account-country",
        "onMismatch": "rejected",
        "note": "Tied to the Microsoft account's country and currency. Xbox Game Pass codes follow separate rules from stored-value cards.",
        "verifiedAt": "2026-09-03"
      },
      "redeemUrl": "https://redeem.microsoft.com",
      "code": {
        "lengths": [
          25
        ],
        "groups": [
          5,
          5,
          5,
          5,
          5
        ],
        "verifiedAt": "2026-09-04",
        "source": "https://support.microsoft.com/en-us/accounts-billing/redeem-a-gift-card-or-code-to-your-microsoft-account"
      },
      "expires": false,
      "regions": [
        {
          "code": "US",
          "currency": "USD",
          "denominations": [
            10,
            15,
            25,
            50,
            100
          ]
        },
        {
          "code": "GB",
          "currency": "GBP",
          "denominations": [
            10,
            15,
            25,
            50
          ]
        },
        {
          "code": "EU",
          "currency": "EUR",
          "denominations": [
            10,
            15,
            25,
            50
          ]
        },
        {
          "code": "TR",
          "currency": "TRY",
          "denominations": [
            100,
            200,
            500
          ]
        }
      ]
    },
    {
      "id": "google-play",
      "name": "Google Play Gift Card",
      "publisher": "Google",
      "category": "app-store",
      "deliveryType": "code",
      "lock": {
        "keyedOn": "account-country",
        "onMismatch": "rejected",
        "note": "Only redeemable in the country where the card was issued, on a Google account with a matching billing country.",
        "verifiedAt": "2026-09-03"
      },
      "redeemUrl": "https://play.google.com/redeem",
      "code": {
        "lengths": [
          16
        ],
        "verifiedAt": "2026-09-04",
        "source": "https://support.google.com/googleplay/answer/3422659"
      },
      "expires": false,
      "regions": [
        {
          "code": "US",
          "currency": "USD",
          "denominations": [
            10,
            15,
            25,
            50,
            100
          ]
        },
        {
          "code": "GB",
          "currency": "GBP",
          "denominations": [
            10,
            15,
            25,
            50
          ]
        },
        {
          "code": "TR",
          "currency": "TRY",
          "denominations": [
            50,
            100,
            250
          ]
        }
      ]
    },
    {
      "id": "amazon",
      "name": "Amazon Gift Card",
      "publisher": "Amazon",
      "category": "retail",
      "deliveryType": "code",
      "lock": {
        "keyedOn": "storefront",
        "onMismatch": "rejected",
        "note": "Marketplace-locked: an amazon.com balance cannot be spent on amazon.co.uk or amazon.de. Each marketplace is effectively a separate wallet.",
        "verifiedAt": "2026-09-03"
      },
      "redeemUrl": "https://www.amazon.com/gc/redeem",
      "code": {
        "lengths": [
          14
        ],
        "groups": [
          4,
          6,
          4
        ],
        "verifiedAt": "2026-09-04"
      },
      "expires": false,
      "regions": [
        {
          "code": "US",
          "currency": "USD",
          "denominations": [
            10,
            25,
            50,
            100,
            200
          ]
        },
        {
          "code": "GB",
          "currency": "GBP",
          "denominations": [
            10,
            25,
            50,
            100
          ]
        },
        {
          "code": "DE",
          "currency": "EUR",
          "denominations": [
            10,
            25,
            50,
            100
          ]
        }
      ]
    },
    {
      "id": "netflix",
      "name": "Netflix Gift Card",
      "publisher": "Netflix",
      "category": "streaming",
      "deliveryType": "code",
      "lock": {
        "keyedOn": "account-country",
        "onMismatch": "rejected",
        "note": "Applies only to a Netflix account billed in the same country and currency as the card.",
        "verifiedAt": "2026-09-03"
      },
      "redeemUrl": "https://www.netflix.com/redeem",
      "code": {
        "lengths": [
          11
        ],
        "verifiedAt": "2026-09-03"
      },
      "expires": false,
      "regions": [
        {
          "code": "US",
          "currency": "USD",
          "denominations": [
            25,